after_treatment,text
男票 送 感觉 触屏 操作 都 挺 好 玩 吃 鸡 很 溜,男票送的，感觉触屏操作什么都挺好的，玩吃鸡也很溜
督促 好好学习 _ τ ∠ _,督促自己好好学习_(：τ」∠)_
特别 喜欢 客服 说 这款 性价比 超高,特别喜欢 客服也说这款性价比超高
新 ipad 超级 快 物流 超快 第一天 下单 第二天 这次 购物 体验 很 满意,新ipad超级快而且物流超快第一天下单第二天就到了，这次购物体验很满意！
第一次 买 平板 挺棒 体验,第一次买平板，挺棒的体验
超 喜欢 爱不释手,超喜欢 爱不释手
很 不错,很不错
没想到 快 给力 目前 来看 不错,没想到这么快，给力，目前来看不错的！
宝贝 很 喜欢 非常 棒,宝贝很喜欢，非常棒
物流 非常 快 机身 很 轻薄 日常 用来 看书 看剧 足够,物流非常快，机身很轻薄，日常用来看书看剧足够了
大屏幕 瞅 起来 确实 爽,大屏幕瞅起来确实爽
下 好多 学习 软件 提高 生产力 很 不错,下了好多学习软件，提高生产力，很不错
物流 速度 很快 很快 隔天 开箱 很 惊艳 深空 灰 真的 太帅 屏幕 很 清晰 ipad air 机身 厚度 6s 还 薄 轻薄 手感 超棒 giao 我里 giao 呼 ~,物流速度很快很快，隔天就到啦，开箱很惊艳！！深空灰真的太帅啦！！屏幕很清晰，ipad air的机身厚度比我的6s还薄！！轻薄手感超棒，哈哈一giao 我里giao！呀呼~
电脑 性能 确实 好,电脑性能：确实好
太棒 绝对 正品,太棒啦！！绝对正品！！
不愧 Air 系列 很薄 现在 类纸 膜 保护 壳,不愧是Air系列 很薄 现在就等着类纸膜和保护壳啦
使用 感 非常 好,使用感非常好
觉得 挺 好,我觉得挺好的
终于 拿到 心心念念 iPad 好赞,终于拿到心心念念的iPad了 好赞！！！
非常 不错,非常不错
一段时间 超级 好 操作 流畅 使用 时间 很长 反应速度 很快 真的 超级 喜欢 mac 使用方便 不少 两个 毕竟 方面 不 外观 材质 外观 很 喜欢 干净 简洁 大方 显卡 效果 操作 流畅,用了一段时间超级好。操作流畅。使用时间很长。反应速度很快。真的超级喜欢。比mac使用方便不少 不过两个毕竟方面不一样。 外观材质：外观很喜欢干净简洁又大方 显卡效果：操作流畅
外观 材质 超薄 质感 一贯 优秀 接缝 完美 显卡 效果 游戏 性能 极佳 显示 效果 惊艳 电脑 性能 小 五十万 安兔 兔 跑 分干 不够,外观材质：超薄，质感一贯优秀，接缝完美 显卡效果：游戏性能极佳，显示效果惊艳 电脑性能：小五十万的安兔兔跑分干啥不够哇
物流 超快 24 小时 都 不到 收到,物流超快哈 24小时都不到就收到了
很 好 很 好看 很 好,很好，很好看也很好用
真香 警告,真香警告！
超级 好 屏幕 很大 很 轻薄 买来 学习 64g 感觉 够用,超级好！屏幕很大，但是很轻薄，买来学习用的，64g感觉够用了
儿子 很 喜欢,儿子很喜欢！
物流 太快 太薄 手感 太好了 喜欢 女生 看个 颜值 太 喜欢,这物流也太快了 他也太薄了吧 手感太好了 喜欢 女生嘛就是看个颜值 太喜欢了
挑 很 久 终于 选 air3 很 满意,挑了很久终于选了air3 还是很满意的
使用 快 半个 月 评价 十分 流畅 耗电 慢 几年,使用了快半个月来评价，十分流畅，耗电慢，可以用几年
非常 不错 体验 很 流畅,非常不错的体验 很流畅
发货 快 好看,发货快，好看
真的 很 喜欢 配送 很快 服务态度 真的 好 配送 员 很 耐心,真的很喜欢了。配送很快，服务态度真的好，配送员也很有耐心。
官方 正品 谢谢,官方正品！谢谢！
很 不错 看电视 玩 剧本 杀 都 很 方便,很不错！看电视玩剧本杀都很方便！
第一个 苹果 产品 奈斯,第一个苹果产品 奈斯
几天 挺 好,用了几天 挺好的
很 好 正品 速度 很快,很好，是正品，速度很快
不错 非常 流畅,不错，非常流畅
正品 到货 没有 一点 瑕疵 没有 踩 雷 绝对 好用 没用 弯曲 现象 打游戏 特别 爽 超级 薄 做 笔记 超级 好 人 都 入 强烈 安利,正品！到货没有一点瑕疵！也没有踩雷！绝对好用，也没用弯曲的现象，打游戏特别爽！超级薄！做笔记超级好！各种人都可以入！强烈安利！
3 号 晚上 买 5 号 中午 收到 快递 顺丰 很快 没想到 现在 情况 会 发货 送货 哈哈哈 哈哈哈 第一次 苹果 产品 开机 设置 ID 没有 想象 中 难 容易 上 手 平板 屏幕 大 很 轻 突然 觉得 手机 不好 买前 生产力 买后 爱奇艺 不 后悔 哈哈哈 哈哈哈,3号晚上买的，5号中午收到的快递。顺丰很快，没想到现在的情况也会发货送货哈哈哈哈哈哈。第一次用苹果产品，开机设置ID也没有想象中的难。容易上手，平板屏幕大也很轻，突然觉得手机不好用了。。。买前生产力买后爱奇艺，那我也不后悔哈哈哈哈哈哈
不错 电视 看,不错 当电视看
质量 杠杠 反应 飞快 官网 保证 希望 能够 长久 好,质量杠杠的，反应飞快，官网就是有保证，希望能够长久的好
香 香 不卡顿 屏幕 清晰 指纹识别 很快 看剧 很爽 非常 轻便 密码 填充 很 方便 分屏 非常 优秀 配合 Applepe il 简直 买后 生产力 开机 时 遇到 点 问题 客服 小姐姐 很快 帮忙 解决 GoodNotes notability procreate 非常 非常 加 分 专为 iPad 开发 APP 生态 确实 比安卓 平板 做 好 太 姐妹 买,香还是香的，不卡顿，屏幕清晰，指纹识别很快，看剧很爽，拿着也非常轻便。密码填充也很方便，分屏非常优秀，配合Applepe**il简直了！买后也可以生产力！开机时遇到点问题，客服小姐姐也很快帮忙解决了。GoodNotes，notability，procreate非常非常加分。还有各种专为iPad开发的APP，生态确实是比安卓平板做的好太多。姐妹们买它！！
感觉 还 不错 正在 后续 再 追评,感觉还不错，正在用后续再追评
不错 买 看到 很多 差评 内心 很 慌 想 退货 感觉 买回来 之后 很 忐忑 拆开 真的 不错 诶 10 天才 评价 12 天就充 一次 电 当然 没有 看 电视剧 没有 玩游戏 用来 听歌 旗舰店 没有 测 很 放心 机子 充 一次 电是 发 之前 挺不错 很多 人有 出现 问题 觉着 应该 地区 问题 北京 东西 都 不差 毕竟 首都 不 可能 出现 问题 感觉 应该 地域 问题 个人 问题 好 话 用来 小伙伴 参考 下 很多 游戏 采用 几十个 G 256 真的 大 感觉 买 128 都 够用 不 差钱 买 256 其实 内心 想 时间 长点 挺快 反应 很快 手湿 指纹 打开 正常 手 出汗 很棒 几个 月 再 追评 屏是 真的 大 哈哈哈哈 够用 对比 图 看 一下 面膜 盒 平板 对比 反正 觉着 挺大,不错的，一开始买的时候看到很多差评内心很慌，想退货的感觉，买回来之后很忐忑拆开了，是真的不错诶，用了10多天才来评价，12天就充了一次电，当然没有看电视剧也没有玩游戏一直用来听歌了，旗舰店嘛没有测但是很放心的，机子就充了一次电是发之前冲的，挺不错的，至于很多人有的出现问题我觉着吧应该是地区问题，我在北京东西都不差毕竟首都不可能出现那些问题，所以我感觉应该是地域问题还有就是个人问题，好了我这些话就用来给其他小伙伴作为参考了，下了很多游戏采用了几十个G，256是真的大，感觉买128的都够用，但是不差钱所以买了个256的其实内心也想用的时间长点哈哈，然后就是挺快的，反应很快，手湿的话也可以指纹打开，正常的手出汗，很棒，等过几个月再来追评，屏是真的大哈哈哈哈够用了有对比图可以看一下，面膜盒和平板对比，反正我觉着挺大哈哈
挺 好 质量 很棒,挺好的。质量也很棒。
10.5 真的 非常 爽 钱 没 白花 pro air 中间 纠结 看看 片用 完全 OK,10.5真的非常爽 钱没白花 在pro和air中间纠结 只是看看片用 完全OK
真 好 真棒 特别 好 特别 棒 ipad 很棒 Applepe il 很棒 物流 超快 前一天 晚上 下单 第二天 中午 嘻嘻 买,真好！真棒！特别好！特别棒！ipad很棒Applepe**il也很棒，物流超快，前一天晚上下单第二天中午就到嘻嘻。买它！
目前 还 不错 香 之前 纠结 air ipad19 感觉 air 还 不错 纠结 内存 用久 app 内存 很大 选择 256 深灰色 真的 很 耐看 配上 绿 壳子 nice,目前还不错，香～，之前纠结air和ipad19，感觉air还不错，然后纠结内存，用久了app的内存很大，所以又选择了256，深灰色真的很耐看，配上绿的壳子，nice
家里 都 苹果 东西 笔 挺好用,家里用的都是苹果的东西，笔也挺好用的
官网 放心,还是官网放心
挺 劲,用着挺得劲
公司 年会 礼物 发货 快 赞 棒,公司年会礼物，发货快。赞。棒。
️ 看 后面 使用 咋样,🉑️ 看后面使用咋样
苹果 iPad 手机 很 好,一直用苹果iPad跟手机 很好用
很 好 很 开心 打开 无纸化 学习 新世界 大门,很好用 很开心打开无纸化学习的新世界大门
很 手感 物有所值,很有手感，物有所值
买来 刷剧何 学习 大学生 优惠 还 挺不错 官网 正品 买 放心,买来刷剧何学习用，有大学生优惠还挺不错的，官网正品，买着放心
喜欢 不得了 客服 太好了 第一次 苹果 产品 官 网上 注册 客服 一万 点 好评,喜欢的不得了 客服也太好了吧 第一次用苹果的产品，一开始得在官网上注册 给客服一万点好评
超 好看 买前 生产力 买后 保证 不 打游戏 苹果 物流 速度 一向 很快 包装 简洁 产品 精美 质感 太 喜欢 深灰色 科技 感,超好看！买前生产力！买后保证不打游戏，苹果的物流速度一向很快，包装简洁，产品精美有质感，太喜欢深灰色的科技感了！！
官网 很 放心 ❁ ´ ω ` ❁,官网很放心(❁´ω`❁)
很 好 很快 好评,很好。很快。好评
感谢 客服 人员 热心 帮助 iPad 好用 谢谢,感谢客服人员热心帮助 iPad好用 谢谢🙏
很 满意 第一次 买 不太会 问 客服 客服 非常 好 服务 很 周到 很 满意,很满意。第一次买，不太会用，问客服，客服非常好，服务很周到。总之，很满意。
一段时间 还 不错,用了一段时间了 还不错
非常 好哟,非常好哟～
真香,真香😘😘😘
好用,好用哦。
第一天 下单 第二天 收到 很 喜欢 买带 卡 好 猫咪 iPad 拍 相机 清晰度 屏幕 画质 真的 棒 图片 清晰 过段时间 再 追评 希望 不会 出现 别人 充不 进去 电 屏幕 好大 哈哈哈,第一天下单，第二天就收到了，很喜欢，买带卡的就好了，猫咪用这个iPad拍的，相机清晰度也可以。屏幕画质是真的棒，图片清晰。过段时间再追评，希望不会出现别人那样充不进去电，另外屏幕好大哈哈哈。
已查 正品 无误 姐妹 放心 买,已查是正品无误 姐妹们放心买
好看 好看 很 不错 教育 优惠 还 分期 客服 小姐姐 超级 耐心,好看呀好看呀，很不错，用了教育优惠，还分期。客服小姐姐也超级耐心的。
爱 真香,爱了，真香啊！
女儿 很 喜欢 好评 好评,女儿很喜欢，好评好评
很 好 很 好 女儿 老妈 速度 很快 很 流畅,很好很好 给女儿和老妈用的 速度很快 很流畅
棒棒 哒 值得 购买 物美价廉 物超所值,棒棒哒值得购买物美价廉物超所值
第二台 iPad 原来 mini2 一款 相对 原来 那款 来说 轻薄 反应 更 迅速 当然 屏幕 大 很多 手感 很 好 重量 手机 还要 轻 儿子 用来 上课 个人 很 满意,第二台iPad了，原来是mini2，这一款相对于原来那款来说轻薄，反应更迅速，当然也是屏幕大很多的，手感很好，重量甚至比手机还要轻，给儿子用来上课的，个人很满意
很 好 屏幕 大 容量 大,很好 屏幕大 容量大
真的 不错 太 喜欢,真的不错，太喜欢了😘
外观 材质 很 好看 灰色 很 气质 显卡 效果 效果 不错 电脑 性能 ipad 性能 冬天 苹果 通病 懂,外观材质：很好看 灰色很有气质 哈哈 显卡效果：效果也不错 电脑性能：ipad性能可以 就是冬天 苹果通病 你们懂的
很 好 花 分 十二 期 真的 太好了 特别 喜欢 希望 小心 使用 坚持 用个 三四年 最后 笔 分期 好,很好用，然后是可以花呗分十二期真的是太好了，特别喜欢，希望自己小心使用，坚持用个三四年。最后如果笔也可以分期就好了
孩子 买 满意,给孩子买的，满意！
官网 买 放心,还是官网买放心！！
屏幕 很大 想不到 第一天 买 后 爱奇艺 哈哈哈,屏幕很大，想不到第一天就买后爱奇艺了，哈哈哈
官网 超级 放心 刚 下单 第二天 早上 送过来 物流 真的 没话说 特 好,官网还是超级放心的 刚下单第二天早上就送过来了 物流真的没话说 特好
还 不错,用着还不错哦
a12 芯片 太强 爱不释手,a12芯片太强了。爱不释手。
很棒 顺丰 物流 真的 强,很棒！ 顺丰的物流也是真的强
非常 轻薄,非常轻薄
刚 一段时间,刚开始用，用一段时间再说
非常 好,非常好～
官方 正品 很 好,官方正品，很好
原来 mini air3 之间 犹豫 考虑 以后 买 air3 一点 不 后悔 很 轻薄 深空 灰 真的 太 好看 很 高级,原来在mini跟air3之间犹豫 但考虑以后还是买了air3 一点不后悔 也很轻薄 深空灰真的太好看 很高级
上 速度 很快,用上了 速度很快
纠结 很 久 最后 买 air3 拿到 手 真的 不 后悔 特别 轻薄 颜色 偏 玫瑰 金 很 好看 屏幕 很 舒服 很大 来看 网课 做 笔记 很 合适 希望 能助 力量 考试,纠结了很久最后买了air3 拿到手真的不后悔 特别轻薄 颜色是偏玫瑰金的 很好看 屏幕很舒服 很大 哈哈用来看网课做笔记很合适 希望能助我力量通过考试
nice,nice
很 好 iPad 之后 就要 笔,很好，有iPad之后就要有笔😂
追剧 神器 几天 后 终于 … 邮政 快递 慢 以外 产品 满意 ~ 分期 免息 毫无 压力 购买 ~,我的追剧神器在等了几天后终于到了…除了邮政快递，有一些慢以外产品还是满意的~分期免息也可毫无压力购买~
物流 非常 快 官网 买 放心 正品 国行 系统 很 流畅 声音 很大 总体 来说 很 满意,物流非常快，在官网买的放心，正品国行，系统很流畅，声音也很大，总体来说很满意
大容量 现在 玩游戏 地方 A12 处理器 只能 说 不能 再 牛 偷偷 说 一下 黑色 很帅,大容量现在玩游戏也有的地方了，A12处理器只能说不能再牛了，偷偷说一下黑色很帅
非常 好 平板 家里 两个 淘汰 新 板子 很薄 不 重 声音 画面 都 很 好 深空 灰 颜色 漂亮 最 关键 分期 免息 太好 太好,非常好的平板，家里另外两个可以淘汰了，新板子很薄不重，声音画面都很好，深空灰颜色也漂亮，最关键的是分期免息太好太好
正品 喜欢,是正品，喜欢
很 舒服 这种 贵重物品 发 邮政 不发 顺丰 看 都 不 觉得 6 天到 邮政 3 天到 顺丰 更 合理,用着很舒服，但是，这种贵重物品为什么发邮政不发顺丰！怎么看都不觉得6天到的邮政比3天到的顺丰更合理
真香 官网 买 决定 正品 买前 生产力 买后 爱奇艺 哈哈哈,真香 官网买的 决定正品 买前生产力 买后爱奇艺 哈哈哈
买来 看电视 灰色 很漂亮 接下来 入手 配件,买来看电视的，灰色的很漂亮，接下来就是入手各种配件了
真的 太 爱 分期 免息 流畅 漂亮 爱不释手,真的是太爱了，分期免息 流畅漂亮 爱不释手 哈哈
外观 材质 手感 巨好 显卡 效果 巨 流畅,外观材质：手感巨好 显卡效果：巨流畅
操作 流畅 机子 完好 官网 旗舰店 谱 快递 真的 令人费解 特殊 时期 发 ems 明明 直接 送到 却 拉 快递 跑 六十多 公里 后 折回来 送,操作流畅，机子也完好，还是官网和旗舰店靠谱。不过，这个快递真的令人费解，由于特殊时期发的是ems，明明可以直接送到的，却又拉着快递跑了六十多公里后又折回来送的😂
苹果 全家 桶 越来越 喜欢 生产力 十足,苹果全家桶越来越喜欢了，生产力十足
临近 期末 复习 买 ipad 使用 起来 很 方便 无论是 质感 手感 画质 都 很棒 空运 很快 不足之处 充电 慢 使用 停久 觉得 主要 看 使用 软件 学习 一天 半到 两天 样子,临近期末复习的时候买的，ipad使用起来很方便，无论是质感手感还是画质都很棒，空运的，很快！不足之处就是充电慢，不过使用停久的，我觉得主要是看你使用什么软件吧，学习的话，我可以用一天半到两天这样子
满意 反应 快 电量 耐用 充电 头 容易 发烫,满意，反应也快，电量也耐用，就是充电头容易发烫
很 不错 很 好 很 喜欢 苹果 不 使用 起来 很 顺畅 客服 态度 很 好 帮忙 解答 问题 很 nice 希望 买 真的 能够 派上用场 好好学习,很不错！很好！很喜欢！苹果就是不一样，使用起来很顺畅，而且客服态度也很好哦！一直帮忙解答问题什么的！很nice，希望买了这个真的能够派上用场，好好学习！
很 好 真的 很 喜欢,很好，真的很喜欢
真香 建议 官网 买 售后 保障,真香 建议在官网买 售后有保障
不错 喜欢,不错，喜欢
买前 生产力 买后 爱奇艺 很香,果然买前生产力买后爱奇艺，不过很香
用来 学习 很 方便 娱乐 很 不错,用来学习很方便，娱乐也很不错。
很 好 之前 还 por 之间 犹豫 几天 觉得 air 够用,很好，之前还在por之间犹豫，用了几天觉得air也够用了
激活 后 注册 新 号 有点 慢 客服 小姐姐 很 耐心 包装 完整 应该 正品,激活后，注册新号有点慢客服小姐姐很耐心，包装完整，应该是正品
买来 直接 锤 杀 彰显 民族 气概,买来直接锤杀，彰显民族气概
非常 好 买 air3 没买错 很薄 很 轻 屏幕 尺寸 很 适合 书写 爱奇艺 生产力 都 很 优秀 哈哈哈哈,非常好，买air3没买错，很薄很轻，屏幕尺寸也很适合书写。不管是爱奇艺还是生产力都很优秀哈哈哈哈。
超好 爱 爱 ⑉ ° з ° ♡,超好用，爱了爱了(⑉°з°)-♡
官网 相信 正品 客服 林丽 很 耐心 好评 物流 快,官网相信是正品呀 客服林丽很耐心 好评呀物流也快
圣诞礼物 第二天 送到 很棒,给自己的圣诞礼物，第二天就送到了，很棒！
只能 说 非常 nice 开启 学习 路 ^ ^,我只能说非常nice！！！开启了我的学习之路^ - ^
好用 好 真香 到时候 再 买 类纸 膜 应该 会 写 舒服 一点,好用好用，真香啊，到时候再买一个类纸膜，应该会写的舒服一点
深空 灰 很 好看,深空灰很好看～
很 轻 很薄 画质 很 好,很轻！很薄！画质很好！
拿到 ipad 开心 开心,拿到了ipad，开心开心！！
想买个 宝贝 学 英语 苹果 产品 反应速度 依然 很快 这次 活动 买 收到 货后 宝贝 太 喜欢,一直想买个给宝贝学英语用 一直用着苹果产品 这反应速度依然很快 这次趁着活动买了 收到货后 宝贝太喜欢啦
使用 两天 电池 耐用 ios 系统 好用,使用了两天了，电池耐用，ios.系统就是好用！
爱 买来 学习,我爱了！买来学习的！
据说 新 ipad 提高 生产力 对比 很多 款 编辑 文件 最终 入 air 佩奇 周边 适应 现在 操作 手势 之后 觉得 切换 应用 很 方便 加上 键盘 鼠标 pe il 妥妥 笔记本 诞生 携带方便 希望 上 ipad 经用 快 7 年,据说新的ipad可以提高生产力，对比了很多款，为了编辑文件，最终入了air，并佩奇周边。适应了现在的操作手势之后，觉得切换应用很方便，加上键盘鼠标和pe**il，妥妥一个笔记本诞生，且携带方便，希望能像上一个ipad一样经用（快7年了）。
快 一个月 才 评价 觉得 蛮 好 尤其 打游戏 非常 流畅 正品 大家 放心 闭眼 入,用了快一个月了才来评价的，我觉得蛮好的啊，尤其是打游戏非常的流畅，而且是正品，大家放心啦，闭眼入就可以
预算 不够 想要 大屏 做 笔记 选择 64g 10.5 寸屏 很大 运行 很 流畅 体验 感 很 好 还 不太熟悉 分屏 功能 主要 想 百度网 盘 一边 看 视频 一边 做 笔记 发现 网盘 调出 笔记 只能 侧边 栏 出现 比例 很 尴尬 查 一下 air3 分屏 感觉 操作 没 毛病 后来 发现 浏览器 成功 五五分 屏 很多 软件 却 不行 突然 有种 吃 屎 感觉 视频 软件 里 不能 分屏 还 愉快 做 笔记 导致 闲置 好 几天 期间 看 几集 电视剧 … 感觉 生产力 值 已经 降为 0 买 很 纠结 air3 mini5 主要 屏 问题 不是 做 笔记 更 喜欢 mini5 便宜 便携 可爱 明天 再 研究 研究 记笔记 更 舒服 类 纸膜 春节 还 没有 发货 电容 笔写 起来 总 觉得 写 玻璃 上 … 酱 东西 很 好 教育 优惠 苏宁 价格 差 不了 几百 官网 分期 没有 手续费 挺 好 好评 好奇 官网 知道 学生 朋友 打开 同样 界面 没有 教育 优惠 四个 字 莫不是 学信网 合作,因为预算不够，又想要大屏做笔记，就选择了64g。10.5寸屏还是很大的。运行很流畅，体验感很好。只是还不太熟悉分屏功能。我主要是想在百度网盘，一边看视频一边做笔记，但发现在网盘调出笔记只能侧边栏出现，比例很尴尬，查了一下air3怎么分屏，感觉我的操作没毛病，后来发现，浏览器是可以成功五五分屏的，但很多软件却不行，突然就有种吃了屎的感觉，视频软件里不能分屏我还怎么愉快的做笔记，导致我闲置了它好几天，这期间就看了几集电视剧…感觉我的生产力值已经降为0了。买的时候很纠结是air3还是mini5，主要是屏的问题，如果不是为了做笔记，我更喜欢mini5，又便宜，又便携，多可爱啊，明天我再研究研究怎么记笔记更舒服吧，就是我的类纸膜因为春节还没有发货，电容笔写起来总觉得像写在玻璃上一样…就酱，东西还是很好的，而且教育优惠的话，和苏宁价格也差不了几百，而且官网分期没有手续费，挺好的、好评啦。就是好奇官网怎么知道我是学生的、我朋友打开同样的界面就没有教育优惠四个字，莫不是和学信网合作了？
很香,很香
很赞 工作 学习 很 方便,很赞，工作学习很方便！！
第一次 苹果 机器 感觉 很 好 系统 很 流畅 屏幕 很大 官方 旗舰店 里 买 东西 比较 放心 贵 几百块 钱 问题 再来 追评,第一次用苹果的机器，感觉很好，系统很流畅，屏幕也很大，在官方旗舰店里买东西比较放心，虽然贵了几百块钱，有问题再来追评吧
发货 很快 发 顺丰 保护 用户 隐私 没有 写 东西 包装 很 好 相信 官网,发货很快发的顺丰、保护用户隐私没有写是什么东西。包装的也很好。相信官网
包装 完整 激活 后 慢慢 适应 操作 页面 整体 感觉 非常 棒 提高 学习 效率,包装完整，激活后在慢慢适应操作页面 整体感觉非常棒 能提高学习效率
很 好 商品 没 问题 个人 觉得 黑色 应该 更好 看,很好，商品没问题，但个人觉得黑色应该更好看！
香 ~,香~
宝贝 收到 很 好 官网 没 说 第一次 手机 这次 平板 唯一 不足 后壳 几个 小点 痕迹 整体 来说 还好 希望 以后 还 做到 更好 下次 光临,宝贝收到，很好，官网没的说，第一次手机，这次平板，唯一的不足就是后壳有几个小点痕迹，整体来说还好，希望以后还可以做到更好，下次光临！
几天 不错,用了几天不错啦！
目前 没什么 问题 买手机 划算,目前没什么问题，比买手机划算
买前 生产力 买后 爱奇艺,嗯。买前生产力 买后爱奇艺！
发货 第二天 收到 包装 … … 看 一下 显色 外观 都 不错 薄薄的,发货第二天就收到了，包装……也就这样吧，看了一下，显色外观都不错，薄薄的，
想着 买 来看 工程图 编辑 资料 追剧 打游戏 真香,想着买来看工程图、编辑资料的。。。嗯。追剧打游戏真香
一段时间 评价 很 好 很 流畅 电池 耐用 正品 发货 运输 都 很快,用了一段时间来评价的，很好用，很流畅，电池也耐用，是正品，发货运输都很快
挺不错 很 优秀 12 期 免息 加 教育 优惠 美滋滋,挺不错的 很优秀 12期免息 加教育优惠 美滋滋
之前 听到 一句 评论 苹果 产品 没 长进 没 对手 nice nice nice,之前听到一句评论，苹果的产品就是，没长进，没对手：）nice，nice，nice
到货 很快 想 买 很 久 深灰色 很 好看,到货很快，想买很久了啦～深灰色很好看呀
目前 还 不错 大小 正合 心意 喜欢,目前用着一直还不错，大小正合我心意，喜欢
喜欢 不 懂 问 客服 小姐姐 很 耐心 官网 买 东西 保障,喜欢 不懂的问客服 小姐姐也很耐心 官网买东西就是有保障
教育 优惠 12 期 免息 真香,教育优惠12期免息真香
