after_treatment,text
不错 屏幕 很大 看起来 很 舒服 很薄,不错的，屏幕很大看起来很舒服，也很薄
灰色 太 好看 纠结 很 久 不 后悔,灰色太好看了！纠结了很久不后悔
质量 没得说 永远 支持 官网,质量没得说 永远支持官网
说 苹果 香 air3 真香,不管咋说还是苹果香，air3真香
使用 流畅 简洁 舒适,使用流畅简洁舒适
外观 很漂亮 还 没用 用后 再评,外观很漂亮，还没用，用后再评
官网 买 东西 放心,官网买东西就是放心
东西 真 好 真不错,东西真好，用着真不错!
官网 东西 给力,官网的东西就是给力
高大 上 深空 灰,高大上的深空灰！
总体 来说 不错,总体来说不错
苹果 配套 真的 舒适,苹果配套用是真的舒适。
电脑 收到 感觉 还 不错 客服 很 热心,电脑收到了，感觉还不错，客服也很热心。
很棒 还 适应 希望 成为 生产力,很棒，还在适应。希望成为生产力。
很 好 灰色 非常 好看 很 流畅,很好，灰色非常好看，也很流畅
包装 完整 运行 流畅 官网 买 保障 之前 mini 现在 爸爸 这次 买 air 屏幕 尺寸 大 看 视频 刚刚 好,包装完整 运行流畅 在官网买有保障之前一直用mini 现在给爸爸用了，这次买的air 屏幕尺寸大，看视频刚刚好
深空 灰 很 喜欢 后期 回来 追评,深空灰很喜欢，后期回来追评哦
旗舰店 质量 保障 赞,旗舰店，质量有保障，赞！
官网 买 放心 很 好 nice,还是官网买放心，很好nice
很 好 充电 快 屏幕 大小 很 好,很好用，充电也快屏幕大小也很好
买 类纸 膜 二 代笔 写画 起来 真的 特别 舒服,买了类纸膜和二代笔，写画起来真的特别舒服
外观 材质 触屏 灵敏 材质 不错 显卡 效果 OKOKOK 电脑 性能 操作 流畅 贼 舒服,外观材质：触屏灵敏，材质不错 显卡效果：OKOKOK 电脑性能：操作流畅 贼舒服
不错 很 好 性能 很 强劲 很 轻 很薄 上 一代 ipad6 强多,不错，很好，性能很强劲，很轻很薄，比我上一代ipad6 强多了！
整体 来说 很 好 很 轻便 自带 阅读 app 会 吞 笔记 反应 会 一点点 慢 都 很 完美,整体来说很好用，很轻便 自带的阅读app会吞笔记 有的时候反应会有一点点慢 其他都很完美
真的 香 早买 早香,真的香，早买早香
平板 很 好 超薄 手感 好 屏幕 超棒,平板很好哦，超薄，手感好，屏幕超棒！
款 平板 真的 挺好用,这款平板真的挺好用
满足 非常 好,满足了 非常好
感觉 很 不错,感觉很不错
刚用 第一天 先 好评,刚用的第一天，先好评，有什么再说吧
高品质 高 实用 高效率 主要 用来 工作 学习 值得 推荐,高品质，高实用，高效率，主要是用来工作和学习！值得推荐！
屏幕 很大 起来 很 轻薄,可以，屏幕很大，拿起来也很轻薄
外观 材质 很 ok 没有 瑕疵 显卡 效果 nice 电脑 性能 nice,外观材质：很ok没有瑕疵 显卡效果：nice 电脑性能：nice
画 插画 很 好 客服 不行,画插画很好用。客服不行。
非常 棒,非常棒
非常 满意 包装 非常 到位 买 官方 东西 好 十万分 放心,非常满意，包装也非常到位，买官方的东西就是好十万分的放心。
上 ipad 7 年 很 节约,上一个ipad用了7年、我也是很节约了
非常 棒 客服 很 好 苹果 厉害,非常棒，客服也很好，苹果厉害
5 天 后来 评论 买 二 代笔 还 没 买 键盘 套 重量 非常 轻 以前 ipad mini4 差不多 手里 看书 看 视频 不会 累 屏幕 够 大 用来 分屏 很 舒服 无论是 看 视频 聊天 看书 做 笔记 都 适合 ipad air 基本上 满足需要 pro 颜值 屏幕 分屏 效果 都 更好 买 绝对 不会 失望 学生 看 书写 论文 白领 轻 办公 经常 出行 看 视频 喜欢 写字 画画 人 都 很 适合,用了5天后来评论，另外买了二代笔，还没买键盘套。重量非常轻，跟以前的ipad mini4差不多，拿手里看书看视频不会累，屏幕够大用来分屏很舒服，无论是边看视频边聊天还是看书做笔记都适合。虽然ipad air基本上能满足需要，但pro无论颜值，屏幕，还是分屏效果都更好，买了绝对不会失望，学生看书写论文 白领轻办公 经常出行看视频 喜欢写字画画的人都很适合
外观 材质 喜欢 显卡 效果 好用 电脑 性能 很棒,外观材质：喜欢！ 显卡效果：好用！ 电脑性能：很棒！
i 下 单转 天到,俺i，下了单转天到
外观 材质 手感 太好了 喜欢 不像 以前 iPad 那种 中间 厚 两边 薄 画板,外观材质：手感太好了，我喜欢，不像以前iPad那种中间厚两边薄，这就像一个画板一样
不错 不错 晚上 下 订单 第二天 下午,不错不错，晚上下订单，第二天下午就到了
外观 材质 造型 独特 设计 风格 简约 电脑 性能 性能 不用说 很 好,外观材质：造型独特设计风格简约 电脑性能：性能不用说了，很好
描述 基本一致 不愧为 世界名牌 女儿 真的 爱不释手 一贯 以来 不 喜欢 电子产品 爱人 说 真不错 想 玩 一玩 确实 正品 质量 好 客服 很 好 物流 更是 光速,与描述的基本一致，不愧为世界名牌，女儿真的是爱不释手，甚至一贯以来不喜欢电子产品的爱人也说真不错，也想玩一玩，确实是正品，质量就是好！客服很好，物流更是光速！
很 流畅 很 好 外观 挺 好看,很流畅，很好用，外观也挺好看
11 的确 好看 喜欢 大 点 玩游戏 不 习惯,11的确好看，是我喜欢的！就是大了点，玩游戏不习惯。
很 好 很 满意,很好，很满意
买前 生产力 买后 爱奇艺 爱 学习 学习 使 快乐,买前生产力 买后爱奇艺 我爱学习，学习使我快乐
买来 学习 第一次 苹果 产品 刚 不太熟悉 几天 好 苹果 屏幕 确实 好,买来学习用的，第一次用苹果产品，刚开始不太熟悉用几天就好了，苹果的屏幕确实是好的。
挺 好 最新款 价格 相当 美丽,挺好的，最新款，价格也相当美丽
不错 挺 满意 很 流畅 电量 够 足 大爱,不错，挺满意的，很流畅，电量够足，大爱，
早就 到手 特地 星期 才 评价 外观 没有 损坏 机子 好 特别 流畅 物流 快 没话说 贵点 没话说 起来 二个 字 形容 真香,早就到手了特地用了一个星期才来评价，外观没有损坏机子是好的，特别流畅。物流快的没话说。总的来说就是贵点别的没话说。用起来二个字形容：真香！
很 好 完全 用于 学习 十分 足够,很好，完全用于学习是十分足够的了
买前 生产力 买后 爱奇艺 性能 过剩,买前生产力，买后爱奇艺，性能过剩
非常 实用,非常实用
颜值 非常 高 喜欢 喜欢 喜欢 喜欢 非常 给力 喜欢 喜欢 喜欢 再也 不用 老公 抢 电脑,颜值非常高 喜欢喜欢喜欢喜欢非常给力喜欢喜欢喜欢 再也不用跟老公抢电脑用了
外观 材质 地表 最强 绝非 虚传 手感 显卡 效果 色彩鲜艳 分辨率 高 画面 很 细腻 电脑 性能 玩游戏 特效 全开 不卡 不顿 性能 强悍 没得说,外观材质：地表最强绝非虚传，手感可以 显卡效果：色彩鲜艳分辨率高画面很细腻 电脑性能：玩游戏特效全开不卡不顿性能强悍没得说
外观 材质 大气,外观材质：大气
很 棒棒 11 寸 刚刚 好 看 视频 够 大 玩游戏 能够 12.9 寸太大 玩游戏 总有 住 两边 点 不到 技能 感觉 256G 够 很 棒棒,就很棒棒！11寸刚刚好！看视频也是够大的，玩游戏也能够到😂12.9寸太大了，玩游戏总有拿住两边点不到技能的感觉😂，256G也是够我用了，就很棒棒！
很 满意 官网 东西 谱,很满意，官网的东西靠谱
宝贝 收到 完好无损 值得 信赖,宝贝收到了！完好无损，值得信赖。
外观 真的 绝 巨 好看 颜色 很 喜欢 手里 很薄 玩起来 非常 流畅 看 喜欢 充电 不是 苹果 专用 数据线 改用 top c 接口 找 充电器 比较 方便 充电 速度 比较 快 充 一次 大概 用个 两三天 屏幕 很大 看电视 很爽,外观真的绝了，巨好看，颜色也很喜欢，拿在手里很薄，玩起来也非常流畅，怎么看怎么喜欢，充电不是用的苹果专用数据线了，改用top-c接口，找充电器也比较方便，充电速度也比较快，充一次的话大概用个两三天，屏幕很大，看电视很爽。
画画 真 优秀,画画真优秀👌
宝贝 收到 完好无损 值得 信赖 网上 购物 完全 不 虚,宝贝收到了！完好无损，值得信赖。网上购物完全不虚！
第一 有点 小 问题 依凡 客服 很 耐心 人 很 好 新 很 香 当然 炸 香,因为第一开始有点小问题，这个叫依凡的客服很耐心，人很好，新的到了，用着很香，当然，炸🐔也香
很 喜欢 全面 屏 太爽了 本来 想 买 最大 12 寸 想想 没有 必要 iPad Pro 性能 很 好 买 深空 灰色 很 好看 镜头 总是 看不到 都 黑色 ￼ 购物 理念 买 性能 高 买 性能 高 毕竟 不 知道 以后 会 用来 干嘛 买 画笔 特别 想 学 画画 ￼,很喜欢全面屏，太爽了，本来想买那个最大的12寸的，但是想想没有必要，iPad Pro的性能很好，买了深空灰色也很好看，就是镜头总是看不到在哪里，因为都是黑色的。￼我的购物理念就是能买性能高的就买性能高的，毕竟不知道以后会用来干嘛。买了这个和画笔就特别想学画画。￼
香,香
特别 好 特别 喜欢 颜色 高大 上,特别好，也特别喜欢颜色高大上
官方 旗舰店 质量 保证 送货 速度 很快 买 第二天 教育 优惠价格 划算 还 12 期 分期 免息 很 满意 接下来 慢慢 还花 咯,官方旗舰店，质量有保证，送货速度也很快，买的第二天就到了，用了教育优惠价格也划算，还可以12期分期免息，很满意，接下来慢慢还花呗咯
正品 这款 iPad 震撼 到货 很快,正品 被这款iPad震撼到了 到货也很快
来看 视频 还 不错 没有 问题 快递 特别 快 晚上 下单 第二天 早上 很棒,拿来看视频的，还不错，没有什么问题，快递特别快 晚上下单第二天早上就到了很棒
外观 材质 不错 很 喜欢 电脑 性能 性能 不错,外观材质：不错 很喜欢 电脑性能：性能不错
今天 收到 超好 然鹅 一代 笔用 不了 只好 再 入手 二 代笔,今天收到！超好，然鹅一代笔用不了，只好再入手二代笔
好看 ｡ ･ ω ･ ｡ ﾉ ♡,好看(｡･ω･｡)ﾉ♡
女朋友 挺 满意 这次 发货 快 教育 补贴 好,女朋友挺满意，这次发货快，教育补贴好
打开 之后 惊艳 太 好看 很 好 苹果 东西 不,打开之后被惊艳到了，太好看了吧。很好用，苹果的东西就是不一样。
官网 买 放心 顺丰 第二天 很 喜欢 一款 iPad 机身 薄 运行 速度 超级 流畅,官网买的放心，顺丰第二天就到了。很喜欢的一款iPad了，机身薄，运行速度超级流畅
太 喜欢 手感 超棒 音质 爆 爱 爱,太喜欢了，手感超棒，音质也好到爆，爱了爱了！
非常 好用 学习 娱乐 都 特别 方便,非常好用，学习娱乐都特别方便
出门 走 好 几天 回来 确认 晚 宝贝 不错 正在 研究 使用 这次 学习 做 笔记 好帮手 大爱 物流 速度 快递 员太度 一流,出门走了好几天回来确认晚了，宝贝不错，正在研究怎么使用，这次学习做笔记有了好帮手了，大爱！物流速度和快递员太度一流
孩子 超 喜欢,孩子超喜欢！
款式 大方 质感 很 好 好评,款式大方，质感很好。好评！
这用 确实 劲 手感 特别 好,这用的确实是得劲，手感特别好
朋友 介绍 网店 刚 收到 快递 不 知道 好不好 过后 好用 再 追评,朋友介绍的网店，刚收到快递，不知道好不好用，等用了过后，好用再追评
想 买 很 久 真心 不错,想买很久了，真心不错
确实 好 东西,确实是好东西。
外观 材质 特别 好看 接下来 看 弯 不 弯 显卡 效果 信赖 苹果 电脑 性能 害 电脑 有点 麻烦,外观材质：特别好看 接下来就是看他弯不弯 显卡效果：一直信赖苹果 电脑性能：害 就是连电脑有点麻烦
手感 很 好 很 喜欢,手感很好，很喜欢
发货 速度 很快 卖家 服务 目前 很 满意,发货速度很快，卖家服务也好，目前很满意
肾 很 好 还要 分期 割 那种,我的肾很好用，而且还要分期割那种
功能强大 爆 持握 感 非常 舒服 很薄 很 轻盈 爽歪歪 验证 正品 国货 值 真的 值,功能强大到爆！持握感非常舒服，很薄很轻盈，爽歪歪！验证为正品国货，值，真的值！
灰色 很 高雅 笔来 之后 画画 昨天 凌晨 拍 今天 满意,灰色很高雅.等笔来了之后就画画啦！昨天凌晨拍的今天就到了。满意！
发货 很快,发货很快
不错 不错 加上 笔画 起来 效果 很棒,不错不错，加上笔画起来效果很棒
终于 买到 开心 网络 不行 后来 商家 help 需要 update 现在 特别 好用 good,终于买到了 开心 开始网络不行 后来经过商家help 需要update 现在 特别好用 good
收获 快乐 金钱 味道 手感 超级 好 嘿嘿,收获快乐！是金钱的味道！手感超级好！嘿嘿
好看 好用 好 轻,好看好用好轻
包装 完好,包装完好的
好久没 买 新款 ipad 冲着 颜值 买 确实 不错 轻便 但愿 开启 学习 状态,好久没买新款ipad了 冲着这个颜值买的 确实不错 轻便 但愿能开启学习状态
性能 很强 绘画 很 不错,性能很强，绘画🎨很不错
终于 拥有 ipad 开心,终于拥有ipad啦 开心
小 pro 好 喜欢,哦我的小pro我好喜欢你
一定 会 好好 画画,一定会好好画画的！
好用 没得说,好用，没得说！！
十分 好用,十分好用
很 好 感觉 有点 大 哈哈哈,很好，感觉就是有点大，哈哈哈
太 喜欢,我太喜欢了！
都 好 官网 买 东西 膜 套子 都 没 真心 太 失望 不 去 买 真心 觉得 店铺 良心 都 狗 吃,什么都好，官网买东西，一个膜，一个套子都没给，我真心太失望了，这个时候你不给，你让我去哪里买，真心觉得你们店铺良心都被狗吃了！
整体 都 很 满意 很 轻薄 性能 方面 没得说 买来 想 督促 画画,整体都很满意，很轻薄，性能方面没得说，买来就是想督促自己画画的
不 说 太香 躺 床上 摸鱼 不能 再 方便 颜值 很 高 深空 灰 特别 漂亮,啥也不说了，太香了，可以躺在床上摸鱼了！不能再方便了，颜值很高！深空灰特别漂亮！
物流 快 颜值 高 东西,物流快，颜值高，东西也好。
双十 晚上 马 爸爸 发了 大红包 果断 下单 iPad Pro,双十一晚上马爸爸发了大红包，果断下单iPad Pro
太爽了 大屏幕 超轻 性价比 很 高 不愧 苹果,太爽了吧大屏幕，而且超轻，性价比很高，不愧是苹果
pro 只能 说 无敌 太香 配 上 笔画 画 真的 很 方便 不用 电脑前,pro只能说是 无敌 太香了 配上笔画画真的很方便 不用一直待在电脑前了
真香 小时候 很 抗拒 苹果 现在 真的 好香 哈哈哈,真香！小时候我很抗拒用苹果，现在真的好香哦哈哈哈
屏幕 外放 matepad 好 操作 顺滑 续航 10 小时 左右 看剧 神器,屏幕和外放比matepad好 操作顺滑 续航10小时左右 看剧神器
很 不错 苹果 很 牛,很不错，不过苹果还是很牛
东西 不错 iOS 操作系统 不太 习惯,东西不错 就是iOS的操作系统不太习惯了
帮人 下单 真的 非常 好看 太漂亮 很 喜欢 ￼,帮人下单的，真的非常好看，太漂亮了，很喜欢。￼
很 轻薄 不错,很轻薄 不错
很 好 很 好 想要 效果 来说 看 电视屏幕 已经 够,很好很好，是我想要的效果，对我来说看电视屏幕已经够了
显卡 效果 无敌 电脑 性能 无敌 外观 材质 帅气,显卡效果：无敌 电脑性能：无敌 外观材质：帅气。
确实 好 东西 正是 非常 需要 希望 好 很 久,确实是好东西 正是我非常需要的 希望他好用很久
打开 之后 惊艳 太 好看 很 好 苹果 东西 不,打开之后被惊艳到了，太好看了吧。很好用，苹果的东西就是不一样。
发货 超级 快 第一天 下午 下单 第二天 早上 超级 赞 mini4 下岗 官方 放心,发货超级快～第一天下午下单，第二天早上就到啦，超级赞👍我的mini4下岗啦～官方放心。
宝贝 收到 质量 不错 物超所值 好评,宝贝收到了，质量不错，物超所值。给个好评！
电脑 性能 电脑 性能 不用说 显卡 效果 显卡 不错 外观 材质 手感 不错,电脑性能：电脑性能不用说了 显卡效果：显卡不错 外观材质：手感不错
大爱 有没有 推荐 几款 软件,大爱，有没有推荐几款软件？
非常 好用 平板 超出 预期,非常好用的平板。超出预期！
满意 满意 很 好 很 好 很 好 很 好,满意满意很好很好很好很好
看 视频 iPhone x 好多 真香,看视频比iPhone x 好多了，真香
宝贝 挺 好,宝贝挺好
手感 太好了 很 喜欢,手感太好了 很喜欢
颜值 高 屏幕 好,颜值高，屏幕好
外观 材质 外观 买 最大 动力 显卡 效果 非常 好 电脑 性能 平板 性能 相当 强悍 安兔 兔 跑 分 69 万,外观材质：外观是我买他最大的动力 显卡效果：非常好 电脑性能：平板性能相当强悍，安兔兔跑分69万+
非常 好 第一次 买 官网 应该 值得 信耐 贵点 买个 心安,非常好，第一次买，官网应该值得信耐，就是贵点，买个心安
不错 挺好用,不错挺好用
好用 买 键盘,好用 买了键盘
画面 真棒,画面真棒
非常 好用,非常好用
很 好 性价比 很 高,很好，性价比很高
新机 开 不了 机 苹果 电话 客服 折腾 二十分钟 才 打开 估计 路上 挨冻 哈哈哈 挺 好看 话 说 顺丰 快 物流 好评,新机到了开不了机，和苹果电话客服折腾二十分钟才打开，我估计是路上挨冻了哈哈哈，挺好看的，话说，顺丰就是快，给物流好评
暂时 不错 很 舒服 反省 速度 很快 希望 不要 出 问题,暂时用着不错，很舒服，反省速度很快，希望不要出什么问题。
ipad air2 终于 寿终正寝 这款 ipad 非常 好用 主要 用来 王者 买个 小 容量 流畅 爆炸,我的ipad air2终于可以寿终正寝了，这款ipad非常好用，主要用来打王者，所以买个小容量的，流畅到爆炸
不愧 无敌 pro 太 pro,不愧是无敌的pro！太pro了
真香,真香
终于 拿到 很 好,终于拿到了，很好
教育 优惠 入手 颜值 超级 高 入手 半个 月 用来 看电视 ..... 真的 买 前 生产力 买后 爱奇艺 还 没有 买笔 没 办法 很 好 app 只 家用 没带 出去 暂时 还 没 出现 网传 容易 弯 现象,教育优惠入手的 颜值超级高 入手半个月了一直用来看电视.....真的是买前生产力买后爱奇艺（因为还没有买笔 没办法很好的用那些app）因为我只在家用 没带出去过 暂时还没出现网传容易弯的现象。
平板 ipad 最好 prol type c 接头 款 不 里面 系统 苹果 ios 系统 goodnote 下 起来 刷题 刷起来 完美 学习 工具,平板就是ipad最好了，prol 是type c的接头，和其他款不一样，里面的系统是还是苹果的ios系统。goodnote下起来，刷题刷起来，完美的学习工具
外观 材质 手感 超棒 显卡 效果 不错 电脑 性能 挺 好 没有 出现 评论 说 断触 奇葩 问题 棒呆 弯曲 问题 完全 没有 完美,外观材质：手感超棒 显卡效果：不错 电脑性能：挺好 没有出现评论说的断触之类的奇葩问题！棒呆！还有什么弯曲问题，完全没有！完美
一分 价钱 一分货 完美 快递 小哥 非常 认真 都 好评,一分价钱一分货，完美，快递小哥非常认真，都好评
好用 再 搭配 二代 pe il 看 视频 做 笔记 太棒了 屏幕显示 很 舒服 画画 使用 体验 简直 太好了 发货 速度 很快 顺丰 快递 第二天 官方 旗舰店 买 放心 超级 喜欢,好用，再搭配二代pe**il，边看视频边做笔记太棒了，屏幕显示很舒服，也可以画画，使用体验简直太好了。发货速度很快，顺丰快递，第二天就到了。还是在官方旗舰店买放心，超级喜欢。
双十 一快 结束 时 收到 一张 满 减券 临时 抓来 凑单 没有 home 键 开阔 好多 看 电影 视频 都 很 舒服,双十一快结束时，收到了一张满减券，临时抓来凑单的，没有了home键，开阔了好多，看电影视频都很舒服
包装 精美 拿到 手后 体验 感觉 非常 好 运行 非常 流畅 很 开心 很 愉快 一次 购物 好评,包装精美，拿到手后体验的感觉非常好，运行非常的流畅，很开心，很愉快的一次购物，给个好评。。。。。
特意 几天 来评 颜色 声音 方面 都 很 好 非常 喜欢 应该 正品 没查 太贵,特意用了几天来评的，颜色声音各方面都很好，非常喜欢，应该是正品没查，就是太贵了
最 抠 最香 还 说 恃宠而骄 这点 真的 人 很 讨厌 诶 … … OK 说完 滚 去 学习 外观 材质 fine 显卡 效果 fine 电脑 性能 fine,最抠的是你，最香的还是你，我还能说什么呢？恃宠而骄这点是真的让人很讨厌诶……OK，说完了，滚去学习！ 外观材质：fine 显卡效果：fine 电脑性能：fine
外观 材质 无可挑剔 平板 电脑 ipad 考虑 入手,外观材质：无可挑剔，平板电脑只有ipad可以考虑入手。
终于 收到 体验 一下 很 不错 一段时间 再 追评,终于收到，体验一下很不错，用一段时间再追评。
女朋友 买 超好,给女朋友买的，超好用
用安卓 系统 惯 一下 换个 系统 还 挺 不 顺手 很 喜欢 苹果 第一个 入手 苹果 产品 愿 越来越 好,用安卓系统惯了，一下换个系统还挺不顺手。但是一直很喜欢苹果，这是我第一个入手的苹果产品！愿我们彼此越来越好。
下单 第二天 收到 速度 很快 检查 包装 完好 开机 没 问题 机列 号 网上 查询 真的 两周 后 暂时 没有 发现 问题 很 满意,下单第二天收到速度很快，检查包装完好，开机没问题，机列号网上查询真的。两周后暂时没有发现问题很满意
不用说 买 第三个 比较 好用 哈哈哈,不用说了 买第三个了 比较好用 哈哈哈
很 棒棒 用来 画画 推荐 买 pro,就很棒棒 用来画画的 推荐买pro
商品 iPad 牛 逼 整体 感受 很 不错 款 支持 Face ID 解锁 特别 方便 快速 超级 满意 iPad 平板 中 最 顶级 存在 屏幕 再 小 一点 好,商品：iPad还是牛逼，整体感受很不错，而且，这款支持Face ID解锁特别方便，快速。超级满意。iPad还是平板中最顶级的存在。不过屏幕如果再小一点就好了
还 行,还行
非常 喜欢 高兴,非常喜欢💕，高兴😊
很 满意 很 轻薄 直角 设计 很 型 不 容易 滑 双十 一有 优惠 很 划算,很满意很轻薄 直角设计很有型 拿着也不容易滑 双十一有优惠很划算
超级 好用 贴 膜 带 壳 上路,超级好用，贴了膜带了壳，上路
很棒 手感 舒适 运行 流畅 音质 不错 物流 很快,很棒，手感舒适，运行流畅，音质不错，物流很快
mini4 光荣 退休,mini4光荣退休！
发货 很快 很 及时 原装 正品 激活 时间 正确,发货很快，很及时。原装正品，激活时间正确
外观 材质 11 寸 很 轻 很薄 很 手感 显卡 效果 游戏 画面 开 极致 完美 电脑 性能 性能 还 体验 当中 过些日子 再来 追评,外观材质：11寸很轻很薄，很有手感 显卡效果：游戏画面可以开到极致，完美 电脑性能：性能还在体验当中，过些日子再来追评
手感 太好了 很 轻薄 带 出去 很 方便 之前 iPad3 实在 优秀 太 看剧 很爽 音质 很棒,😍手感太好了，又很轻薄，带出去很方便～比之前的iPad3实在是优秀太多，看剧很爽！音质很棒！
外观 材质 很 轻薄 手感 很 好 显卡 效果 没 玩游戏 画画 方便 电脑 性能 流畅 不卡,外观材质：很轻薄，手感很好 显卡效果：没玩游戏但是画画方便 电脑性能：流畅不卡
外观 材质 好 显卡 效果 清 电脑 性能 快,外观材质：好 显卡效果：清 电脑性能：快
完美,完美
特意 一段时间 激活 时间 没有 问题 官方 旗舰店 买 省心 平板 买 苹果 真香,特意用了一段时间，激活时间没有问题，官方旗舰店买的就是省心，平板还是要买苹果，真香！
nice,nice
相中 好久 方面 都 没得说 目前 最强 最美 平板,相中好久了，各方面都没得说，目前最强最美的平板
帮 朋友 买 收到 货 没有 问题 朋友 做 设计 主要 买来 画画 旗舰店 卖 放心 不会 翻新 品质 问题,帮朋友买的，收到货没有任何问题 朋友是做设计的，主要是买来可以画画什么的 旗舰店卖还是放心，不会有翻新什么的品质问题
不错 手感 很 好,不错，手感很好
外观 材质 好 显卡 效果 棒 电脑 性能 好棒,外观材质：好 显卡效果：棒 电脑性能：好棒
耗电 太快 不错 超级 棒,耗电太快。其他不错。超级棒
